{
  "run_id": "research-001",
  "request_id": "req-research-001",
  "source": "gemini-api",
  "model": "gemini-2.5-flash",
  "task": "Summarize the policy memo about refund limits",
  "messages": [
    {
      "role": "user",
      "content": "Summarize the refund limit policy memo and cite the source."
    }
  ],
  "events": [
    {
      "type": "model_call",
      "event_id": "evt-r-001",
      "timestamp": "2026-01-15T11:00:00Z",
      "input": "Summarize the policy memo",
      "output": "I can answer from the memo."
    },
    {
      "type": "retrieval",
      "event_id": "evt-r-002",
      "timestamp": "2026-01-15T11:00:01Z",
      "source_name": "refund-policy-memo.md",
      "content": "Refunds above $100 require manager approval.",
      "metadata": {
        "source": "refund-policy-memo.md",
        "citation": "section-2"
      }
    },
    {
      "type": "final_answer",
      "event_id": "evt-r-003",
      "timestamp": "2026-01-15T11:00:02Z",
      "content": "Based on the source, refunds above $100 require manager approval."
    }
  ]
}
