{
  "run_id": "tool-loop-001",
  "request_id": "req-tool-loop-001",
  "source": "gemini-api",
  "model": "gemini-2.5-flash",
  "task": "Look up ticket T456 before responding to the customer",
  "messages": [
    {
      "role": "user",
      "content": "Look up ticket T456 and tell me the current status."
    }
  ],
  "events": [
    {
      "type": "tool_call",
      "event_id": "evt-l-001",
      "timestamp": "2026-01-16T11:00:00Z",
      "tool_name": "lookup_ticket",
      "args": {
        "ticket_id": "T456"
      }
    },
    {
      "type": "tool_result",
      "event_id": "evt-l-002",
      "timestamp": "2026-01-16T11:00:01Z",
      "tool_name": "lookup_ticket",
      "error": "Ticket service timeout"
    },
    {
      "type": "tool_call",
      "event_id": "evt-l-003",
      "timestamp": "2026-01-16T11:00:02Z",
      "tool_name": "lookup_ticket",
      "args": {
        "ticket_id": "T456"
      }
    },
    {
      "type": "tool_result",
      "event_id": "evt-l-004",
      "timestamp": "2026-01-16T11:00:03Z",
      "tool_name": "lookup_ticket",
      "error": "Ticket service timeout"
    },
    {
      "type": "tool_call",
      "event_id": "evt-l-005",
      "timestamp": "2026-01-16T11:00:04Z",
      "tool_name": "lookup_ticket",
      "args": {
        "ticket_id": "T456"
      }
    },
    {
      "type": "tool_result",
      "event_id": "evt-l-006",
      "timestamp": "2026-01-16T11:00:05Z",
      "tool_name": "lookup_ticket",
      "error": "Ticket service timeout"
    },
    {
      "type": "final_answer",
      "event_id": "evt-l-007",
      "timestamp": "2026-01-16T11:00:06Z",
      "content": "I could not look up the ticket because the ticket service kept timing out."
    }
  ]
}

